{
    "$schema": "https://json-schema.org/draft/2020-12/schema",
    "$id": "https://www.versatile-thermostat.org/plugins.schema.json",
    "title": "Plugins database",
    "description": "Database of plugins for Versatile Thermostat",
    "type": "array",
    "items": {
        "type": "object",
        "description": "A plugin for Versatile Thermostat",
        "properties": {
            "type": {
                "type": "string",
                "description": "The type of the plugin (integration, interface, blueprint, addon)",
                "enum": [
                    "integration",
                    "interface",
                    "blueprint",
                    "addon"
                ]
            },
            "certification": {
                "type": "string",
                "description": "The certification level of the plugin (community, recommended, official)",
                "enum": [
                    "official",
                    "recommended",
                    "community"
                ]
            },
            "name": {
                "type": "string",
                "description": "The name of the plugin"
            },
            "name_fr": {
                "type": "string",
                "description": "The name of the plugin in French"
            },
            "name_de": {
                "type": "string",
                "description": "The name of the plugin in German"
            },
            "description": {
                "type": "string",
                "description": "A short description of the plugin"
            },
            "description_fr": {
                "type": "string",
                "description": "A short description of the plugin in French"
            },
            "description_de": {
                "type": "string",
                "description": "A short description of the plugin in German"
            },
            "slug": {
                "type": "string",
                "description": "The Github slug of the plugin"
            },
            "ha_domain": {
                "type": "string",
                "description": "The Home Assistant domain of the integration (its manifest domain), used to look up active install statistics in Home Assistant Analytics. Only relevant for integrations."
            },
            "author": {
                "type": "string",
                "description": "The author of the plugin"
            },
            "url": {
                "type": "string",
                "description": "The URL of the plugin (used for blueprints)"
            },
            "family": {
                "type": "string",
                "description": "The family to which the plugin belongs",
                "enum": [
                    "algorithm",
                    "interface",
                    "device-helper",
                    "feature"
                ]
            }
        },
        "required": [
            "name",
            "description",
            "certification",
            "type"
        ]
    }
}