[
    {
        "slug": "jmcollin78/versatile-thermostat-ui-card",
        "name": "Versatile Card UI",
        "description": "Versatile thermostat control dashboard card.",
        "type": "interface",
        "certification": "official",
        "family": "interface"
    },
    {
        "name": "VTherm climate replication",
        "description": "<p>VTherm Climate Replication is a Home Assistant custom integration for Versatile Thermostat.</p><p>It links a physical thermostat entity to a Versatile Thermostat climate entity and forwards the physical thermostat state changes to the target VTherm. The goal is to use a real thermostat as a physical remote control for a VTherm.</p>",
        "certification": "official",
        "type": "integration",
        "slug": "jmcollin78/vtherm_climate_replication",
        "author": "jmcollin78",
        "family": "device-helper"
    },
    {
        "name": "VTherm Heating Failure Detection",
        "description": "<p>Home Assistant plugin for heating and cooling failure detection with Versatile Thermostat.</p><p>It monitors how temperature responds to commands from the thermostat's proportional algorithm. When an abnormal condition persists, it publishes a Versatile Thermostat-compatible event and exposes a binary sensor for automations.</p>",
        "certification": "official",
        "type": "integration",
        "family": "feature",
        "slug": "jmcollin78/vtherm_heating_failure_detection",
        "author": "jmcollin78"
    },
    {
        "name": "VTherm Pellet stove",
        "description": "<p>This plugin for Home Assistant is designed to control your pellet stove. Create an <code>over_switch</code> VTherm and link it to this integration to have special regulation algorithm specially designed for pellet stove.</p>",
        "certification": "official",
        "type": "integration",
        "family": "algorithm",
        "slug": "jmcollin78/vtherm_pellet_stove",
        "author": "jmcollin78"
    },
    {
        "name": "VTherm SmartPI",
        "description": "<p>SmartPI is an advanced PI-based thermal control algorithm built around a first-order thermal model (1R1C) rather than a classic PID loop.</p>\n<p>It learns your room's heating capability, heat loss rate and dead time, then uses that model to compute a much more accurate heating command than fixed-time proportional controllers.</p>\n<p><a href=\"https://github.com/KipK/vtherm_smartpi/blob/master/documentation/en/vtherm_smartpi.md\">Documentation</a></p>",
        "certification": "official",
        "type": "integration",
        "family": "algorithm",
        "slug": "kipk/vtherm_smartpi",
        "author": "kipk"
    },
    {
        "name": "HA Entity Explorer",
        "description": "<p>A standalone web application to explore and visualize data history of any Home Assistant entity and its attributes</p>\n<p>Features:</p>\n<p>Entity Browser: Search and select any entity from your Home Assistant instance\nInteractive Charts: Zoom, pan, and explore entity history with ECharts\nAttribute Explorer: Click on chart points to view all entity attributes\nCustom Date Range: Select the time period you want to analyze\nData Export: Export entity or attribute history to JSON for external analysis\nMulti-language: Available in English and French\nEntity Filtering: Whitelist/blacklist entities for security</p>",
        "certification": "recommended",
        "type": "addon",
        "family": "interface",
        "slug": "KipK/ha_entity_explorer",
        "author": "KipK"
    },
    {
        "name": "Sonoff TRVZB linearity",
        "author": "Caius",
        "description": "Blueprint for fine-tuning TRVZB valves and adjusting the opening to the valve linearity, which is often non-linear. This blueprint allows you to create a linear relationship between the valve opening and the actual flow, improving the performance of the heating system.",
        "type": "blueprint",
        "certification": "recommended",
        "url": "https://gist.githubusercontent.com/caiusseverus/abe064b3f8d96896ab377766916e456a/raw/LinearTRV.yaml",
        "family": "device-helper"
    },
    {
        "name": "A graphical Scheduler",
        "description": "<p>Weekly heating schedules for Home Assistant thermostats: thermostats without presets, with presets, or Versatile Thermostat (independent project, not affiliated with Versatile Thermostat):</p>\n<p>schedules you create, duplicate and name (Normal, Remote work, Holidays, Away…), each with a 7-day week per thermostat; one is active, switched from the card or by automations;\nvisual Lovelace editor card (custom:chauffage-programme-card): drag time slots, copy / paste days, several thermostats per day, open a thermostat's more-info dialog from the schedule;\ntemporary overrides: a setpoint changed by hand becomes temporary (2 h by default), shown and adjustable on the card and in the thermostat's more-info dialog, then the thermostat falls back to its schedule.</p>",
        "certification": "community",
        "type": "integration",
        "family": "feature",
        "slug": "armellarcier/ha-chauffage",
        "author": "armellarcier"
    },
    {
        "name": "Equinox",
        "description": "<p>Equinox is a custom Lovelace card for Home Assistant. It is designed for Versatile Thermostat while keeping compatibility with standard climate entities.</p>",
        "certification": "community",
        "type": "interface",
        "family": "interface",
        "slug": "KipK/equinox",
        "author": "KipK"
    },
    {
        "name": "VTherm auto fan extended",
        "description": "<p>For every over_climate VTherm exposing fan_modes, the plugin creates a set of configuration entities and, at each control cycle:</p>\n<ol>\n<li>Computes the temperature gap dtemp = target − current.\n2; Selects the underlying fan_mode whose activation threshold is the greatest one that is > 0 and ≤ |dtemp|, provided it is coherent with the current HVAC mode (heating/cooling/off).</li>\n<li>Otherwise it applies the configured rest fan_mode.</li>\n<li>The chosen fan_mode is only sent to the underlying when it actually changes.</li>\n</ol>\n<p>Each fan_mode gets its own user-configurable threshold (a threshold of 0 means the fan_mode never participates), so non-normalized fan_modes (e.g. on_low / on_high / auto_low / off) are supported out of the box.</p>",
        "certification": "community",
        "type": "integration",
        "family": "feature",
        "slug": "jmcollin78/vtherm_auto_fan_extended",
        "author": "jmcollin78"
    },
    {
        "name": "VTherm Hysteresis",
        "description": "<p>This integration provides a simple hysteresis-based heating algorithm packaged as an external integration for Versatile Thermostat.</p>\n<p>This repository also serve as project scaffold for Vtherm plugins development.</p>",
        "certification": "community",
        "type": "integration",
        "family": "algorithm",
        "slug": "KipK/vtherm_hysteresis",
        "author": "KipK"
    },
    {
        "name": "VTherm inhibition",
        "description": "<p>Home Assistant plugin that lets a Versatile Thermostat (VTherm) step back while another device takes over the room: an electric heater running on PV surplus, an air conditioner heating or cooling, a person heating manually at the valve...</p>\n<p>It can also be used to prevent VTherm from controlling its underlying devices, allowing the user to control them directly without any VTherm interaction.</p>",
        "certification": "community",
        "type": "integration",
        "family": "feature",
        "slug": "alexlenk/vtherm_inhibition",
        "author": "alexlenk"
    }
]